{
  "eventId": "00000000-0000-0000-0000-000000000031",
  "eventType": "user.registered.v1",
  "eventVersion": 1,
  "occurredAt": "2026-07-11T03:00:00Z",
  "producer": "auth-service",
  "aggregateType": "user",
  "aggregateId": "user-1",
  "aggregateVersion": 1,
  "correlationId": "00000000-0000-0000-0000-000000000032",
  "causationId": null,
  "traceparent": null,
  "payload": {
    "userId": "user-1",
    "username": "alice",
    "displayName": "Alice",
    "registeredAt": "2026-07-11T03:00:00Z"
  }
}
