{
  "eventId": "00000000-0000-0000-0000-000000000021",
  "eventType": "follow.created.v1",
  "eventVersion": 1,
  "occurredAt": "2026-07-11T02:00:00Z",
  "producer": "tweeter-service",
  "aggregateType": "follow",
  "aggregateId": "user-1:user-2",
  "aggregateVersion": 1,
  "correlationId": "00000000-0000-0000-0000-000000000022",
  "causationId": null,
  "traceparent": null,
  "payload": {
    "followerUserId": "user-1",
    "followeeUserId": "user-2",
    "changedAt": "2026-07-11T02:00:00Z"
  }
}
