{
  "eventId": "963848ee-80b2-4dde-a875-dc29207b196b",
  "eventType": "leetcode.submission.judge.completed.v1",
  "eventVersion": 1,
  "occurredAt": "2026-07-11T18:00:01Z",
  "producer": "leetcode-judge-worker",
  "aggregateType": "leetcode-submission",
  "aggregateId": "42",
  "aggregateVersion": 1,
  "correlationId": "3ea15042-79b7-4ac2-bcfe-5b8ba85ce534",
  "causationId": "a73c8198-c28d-4bb5-9b9f-04955b5d91df",
  "traceparent": null,
  "payload": {
    "submissionId": 42,
    "status": "ACCEPTED",
    "passedCount": 2,
    "totalCount": 2,
    "executionTimeMs": 18,
    "errorMessage": null
  }
}
